{
  "rank": "lion",
  "label": "Lion",
  "grade": 0,
  "ageRange": "5-6",
  "readingLevel": "grade1",
  "program": {
    "name": "Scouting America Cub Scouts",
    "year": 2024,
    "indexUrl": "https://www.scouting.org/programs/cub-scouts/adventures/lion/",
    "fetchedOn": "2026-10-03"
  },
  "adventures": [
    {
      "id": "lion.bobcat",
      "name": "Bobcat",
      "category": "bobcat",
      "required": true,
      "sourceUrl": "https://www.scouting.org/cub-scout-adventures/bobcat-lion/",
      "fetchedOn": "2026-10-03",
      "summary": "Start your Lion trail! Meet your den and learn to be friendly.",
      "requirements": [
        {
          "id": "lion.bobcat.1",
          "number": "1",
          "adultText": "Spend time meeting the other Lions and adult partners in your den, learning names and a little about each person.",
          "kidText": "Meet the kids in your den. Say hi. Learn each name.",
          "digital": false,
          "activity": {
            "type": "fieldMission",
            "params": {
              "title": "Meet your den",
              "kidSteps": [
                "Say hi to each Scout.",
                "Learn each name.",
                "Tell your name, too."
              ],
              "parentNote": "Approve once your Lion has met the den and can name a few new friends. Name songs, games, or a den craft all work.",
              "evidence": "checklist"
            }
          },
          "practice": {
            "type": "quiz",
            "params": {
              "questions": [
                {
                  "prompt": "How many fingers make the Cub Scout sign?",
                  "choices": [
                    "Two",
                    "Five",
                    "One"
                  ],
                  "answer": 0,
                  "explain": "Two! It looks like wolf ears."
                },
                {
                  "prompt": "You see the sign. What do you do?",
                  "choices": [
                    "Stop and listen",
                    "Keep on talking",
                    "Run around"
                  ],
                  "answer": 0,
                  "explain": "Stop and listen. Then everyone can hear."
                }
              ]
            }
          },
          "lesson": {
            "lines": [
              "Hold up two fingers.",
              "That is the Cub Scout sign.",
              "It looks like wolf ears!",
              "When you see it, stop and listen."
            ]
          },
          "notes": "The sign practice comes from the official \"Lions Talk and Lions Listen\" option for this requirement. Lion Bobcat does not ask for the Oath, salute or handshake."
        },
        {
          "id": "lion.bobcat.2",
          "number": "2",
          "adultText": "Your adult partner or den leader reads you the Scout Law. Then you show, in your own way, what being friendly means.",
          "kidText": "A grown-up reads the Scout Law to you. Then show what friendly means.",
          "digital": false,
          "activity": {
            "type": "fieldMission",
            "params": {
              "title": "Be friendly",
              "kidSteps": [
                "Listen to the Scout Law.",
                "Show what friendly means.",
                "Be friendly to someone."
              ],
              "parentNote": "Read the Scout Law aloud (any copy works). Then ask your Lion to show or tell what being friendly looks like: saying hi, sharing, or asking someone to play. Approve once they have shown it.",
              "evidence": "checklist"
            }
          },
          "practice": {
            "type": "sort",
            "params": {
              "prompt": "Which ones are friendly? Sort them.",
              "bins": [
                {
                  "id": "friendly",
                  "label": "Friendly"
                },
                {
                  "id": "not",
                  "label": "Not friendly"
                }
              ],
              "items": [
                {
                  "label": "Say hi to a new kid",
                  "bin": "friendly"
                },
                {
                  "label": "Share your toys",
                  "bin": "friendly"
                },
                {
                  "label": "Ask a kid to play",
                  "bin": "friendly"
                },
                {
                  "label": "Grab a toy away",
                  "bin": "not"
                },
                {
                  "label": "Say go away",
                  "bin": "not"
                },
                {
                  "label": "Leave a kid out",
                  "bin": "not"
                }
              ]
            }
          },
          "lesson": {
            "lines": [
              "This is the Scout Law. A grown-up reads it to you.",
              "One point is friendly. A friendly Scout is kind to all.",
              "Say hi. Share. Ask a kid to play."
            ],
            "poster": {
              "title": "Scout Law: A Scout is",
              "lines": [
                "Trustworthy",
                "Loyal",
                "Helpful",
                "Friendly",
                "Courteous",
                "Kind",
                "Obedient",
                "Cheerful",
                "Thrifty",
                "Brave",
                "Clean",
                "Reverent"
              ]
            }
          }
        },
        {
          "id": "lion.bobcat.3",
          "number": "3",
          "adultText": "At a den meeting or at home, tell your adult partner about a time you lived out the Cub Scout motto, Do Your Best.",
          "kidText": "Our motto is Do Your Best. Tell a grown-up when you did your best.",
          "digital": false,
          "activity": {
            "type": "fieldMission",
            "params": {
              "title": "Do your best",
              "kidSteps": [
                "Think of a time you tried hard.",
                "Tell a grown-up about it.",
                "Say the motto: Do Your Best!"
              ],
              "parentNote": "Listen as your Lion tells about a time they tried hard, at home or at a den meeting. It does not have to be a win; effort is the point. Approve once they have shared.",
              "evidence": "checklist"
            }
          },
          "practice": {
            "type": "quiz",
            "params": {
              "questions": [
                {
                  "prompt": "What is the Cub Scout motto?",
                  "choices": [
                    "Do Your Best",
                    "Be the First",
                    "Win Every Game"
                  ],
                  "answer": 0,
                  "explain": "Do Your Best! Try hard and be proud."
                },
                {
                  "prompt": "What does doing your best mean?",
                  "choices": [
                    "Try hard",
                    "Always win",
                    "Give up fast"
                  ],
                  "answer": 0,
                  "explain": "You try hard. You do not have to win."
                }
              ]
            }
          },
          "lesson": {
            "lines": [
              "This is the Cub Scout motto. A motto is a short saying.",
              "Doing your best means you try hard.",
              "You do not have to win.",
              "Trying hard is what counts!"
            ],
            "poster": {
              "title": "Cub Scout Motto",
              "lines": [
                "Do Your Best"
              ]
            }
          }
        },
        {
          "id": "lion.bobcat.4",
          "number": "4",
          "adultText": "At home, a parent or guardian goes through the activities in the Scouting America child abuse prevention booklet with the Lion.",
          "kidText": "Sit with your grown-up. You will do some pages together.",
          "digital": false,
          "activity": {
            "type": "fieldMission",
            "params": {
              "title": "Pages together",
              "kidSteps": [
                "Sit with your grown-up.",
                "Do the pages together.",
                "Ask any questions you have."
              ],
              "parentNote": "Do the activities in the booklet \"How to Protect Your Children from Child Abuse: A Parent's Guide\" with your Lion, at home. This is a private family time; the game never asks what you talked about. Approve once you have finished.",
              "evidence": "checklist"
            }
          }
        }
      ]
    },
    {
      "id": "lion.mountain-lion",
      "name": "Mountain Lion",
      "category": "outdoors",
      "required": true,
      "sourceUrl": "https://www.scouting.org/cub-scout-adventures/mountain-lion/",
      "fetchedOn": "2026-10-03",
      "summary": "Go outside with six helpers. Learn what to do if you get lost.",
      "requirements": [
        {
          "id": "lion.mountain-lion.1",
          "number": "1",
          "adultText": "Learn the six items Cub Scouts bring outdoors (water bottle, whistle, flashlight, trail snack, sun protection, first-aid kit) and show what each one is for.",
          "kidText": "Six helpers go outside with us. Learn them. Show what each one does.",
          "digital": false,
          "activity": {
            "type": "fieldMission",
            "params": {
              "title": "Six helpers",
              "kidSteps": [
                "Find your six helpers.",
                "Show what each one does.",
                "Pack them in a bag."
              ],